{
  "schema": "newboo-copy-language-v1",
  "copy_language_id": "copylang_example_account_revision_1",
  "copy_language_hash": "f0bb2911320683771ece937eaa2291e5abe6a13ec10a47e3fb53067ddefa9920",
  "context_pack_id": "ctx_example_account_revision_1",
  "context_hash": "5961044fafce498e72fe3e527f94a3a3a897e690b8404afab097796c50bba331",
  "locale": "en-US",
  "books": [
    {
      "book_id": "book_example",
      "surface_forms": [
        {"form_id":"form_premise_clause","fact_id":"fact_premise","surface_type":"clause","text":"a letter arrives from tomorrow","spoiler_level":0,"composition_groups":["core_arc"]},
        {"form_id":"form_premise_alt_clause","fact_id":"fact_premise","surface_type":"clause","text":"a message arrives from their future self","spoiler_level":0,"composition_groups":["core_arc"]},
        {"form_id":"form_conflict_clause","fact_id":"fact_conflict","surface_type":"clause","text":"the letters start giving instructions","spoiler_level":0,"composition_groups":["core_arc"]},
        {"form_id":"form_promise_question_body","fact_id":"fact_promise","surface_type":"question_body","text":"foreknowledge a gift or a trap","spoiler_level":1,"composition_groups":["core_arc"]}
      ],
      "templates": [
        {
          "template_id":"tpl_hook_what_if","role":"hook","angle_types":["premise","conflict"],
          "parts":[{"kind":"literal","text":"What if "},{"kind":"slot","slot_id":"premise","fact_kinds":["premise"],"surface_types":["clause"]},{"kind":"literal","text":"?"}],
          "require_shared_group":false,"allow_fact_reuse":false,"max_output_chars":90
        },
        {
          "template_id":"tpl_hook_arc","role":"hook","angle_types":["conflict"],
          "parts":[{"kind":"literal","text":"First, "},{"kind":"slot","slot_id":"premise","fact_kinds":["premise"],"surface_types":["clause"]},{"kind":"literal","text":". Then "},{"kind":"slot","slot_id":"conflict","fact_kinds":["conflict"],"surface_types":["clause"]},{"kind":"literal","text":"."}],
          "require_shared_group":true,"allow_fact_reuse":false,"max_output_chars":140
        },
        {
          "template_id":"tpl_tension_then","role":"tension","angle_types":["conflict"],
          "parts":[{"kind":"literal","text":"Then "},{"kind":"slot","slot_id":"conflict","fact_kinds":["conflict"],"surface_types":["clause"]},{"kind":"literal","text":"."}],
          "require_shared_group":false,"allow_fact_reuse":false,"max_output_chars":100
        },
        {
          "template_id":"tpl_payoff_question","role":"payoff","angle_types":["conflict"],
          "parts":[{"kind":"literal","text":"So: is "},{"kind":"slot","slot_id":"question","fact_kinds":["promise"],"surface_types":["question_body"]},{"kind":"literal","text":"?"}],
          "require_shared_group":false,"allow_fact_reuse":false,"max_output_chars":100
        }
      ]
    }
  ]
}
